[
  {
    "id": "mem_20260801_103000_abc123",
    "schema_version": 2,
    "scope": "global",
    "visibility": "global",
    "owner_agent": "agent-lead",
    "created_at": "2026-08-01T10:30:00+08:00",
    "updated_at": "2026-08-01T10:30:00+08:00",
    "source_conversation_id": "example-conv-001",
    "type": "decision",
    "title": "Auth service uses SQLite",
    "summary": "Chose SQLite over PostgreSQL for the auth service because it is a single-user desktop app with no concurrent write requirements. Simplifies deployment and eliminates DB server dependency.",
    "details": "Evaluated SQLite, PostgreSQL, and MySQL. SQLite won on simplicity. If multi-user support is added later, migration to PostgreSQL is straightforward via SQLAlchemy.",
    "tags": ["database", "architecture", "auth", "sqlite"],
    "importance": 0.85,
    "priority": "P1",
    "access_count": 2,
    "last_accessed": "2026-08-03T14:20:00+08:00",
    "related_files": ["src/auth/db.py", "config/database.yaml"],
    "ttl_days": null,
    "expires_at": null,
    "decay_score": 0.8,
    "status": "active",
    "embedding": null,
    "embedding_model": null
  },
  {
    "id": "mem_20260802_091500_def456",
    "schema_version": 2,
    "scope": "global",
    "visibility": "global",
    "owner_agent": "agent-fe",
    "created_at": "2026-08-02T09:15:00+08:00",
    "updated_at": "2026-08-02T09:15:00+08:00",
    "source_conversation_id": "example-conv-002",
    "type": "debug_solution",
    "title": "CORS error fix via nginx config",
    "summary": "CORS 403 errors were caused by missing Access-Control-Allow-Origin header in nginx reverse proxy config. Fixed by adding appropriate CORS headers in the nginx location block.",
    "details": "The browser blocked requests from localhost:3000 to api.example.com:8080. Root cause was nginx proxy_pass stripping CORS headers. Added: add_header 'Access-Control-Allow-Origin' '$http_origin'; add_header 'Access-Control-Allow-Methods' 'GET, POST, OPTIONS';",
    "tags": ["cors", "nginx", "debugging", "frontend"],
    "importance": 0.8,
    "priority": "P1",
    "access_count": 5,
    "last_accessed": "2026-08-04T16:45:00+08:00",
    "related_files": ["nginx/conf.d/api.conf"],
    "ttl_days": null,
    "expires_at": null,
    "decay_score": 0.72,
    "status": "active",
    "embedding": null,
    "embedding_model": null
  },
  {
    "id": "mem_20260803_140000_ghi789",
    "schema_version": 2,
    "scope": "global",
    "visibility": "global",
    "owner_agent": "agent-lead",
    "created_at": "2026-08-03T14:00:00+08:00",
    "updated_at": "2026-08-03T14:00:00+08:00",
    "source_conversation_id": null,
    "type": "preference",
    "title": "User prefers concise responses",
    "summary": "User prefers short, direct answers without verbose explanations. Use bullet points for multi-item responses. Communicate in Chinese when discussing design, English for code.",
    "details": null,
    "tags": ["communication", "style", "preference"],
    "importance": 0.7,
    "priority": "P2",
    "access_count": 0,
    "last_accessed": null,
    "related_files": [],
    "ttl_days": null,
    "expires_at": null,
    "decay_score": 0.7,
    "status": "active",
    "embedding": null,
    "embedding_model": null
  },
  {
    "id": "mem_20260804_110000_jkl012",
    "schema_version": 2,
    "scope": "global",
    "visibility": "global",
    "owner_agent": "agent-devops",
    "created_at": "2026-08-04T11:00:00+08:00",
    "updated_at": "2026-08-04T11:00:00+08:00",
    "source_conversation_id": "example-conv-003",
    "type": "workflow",
    "title": "Deployment checklist for ai4s-backend",
    "summary": "Deploy flow: 1) Run lint check 2) Run unit tests 3) Build JAR with Maven 4) Push to staging 5) Run smoke tests 6) Promote to production. Always run lint before tests to catch formatting issues early.",
    "details": null,
    "tags": ["deployment", "ci-cd", "java", "ai4s-backend"],
    "importance": 0.9,
    "priority": "P1",
    "access_count": 1,
    "last_accessed": "2026-08-04T15:30:00+08:00",
    "related_files": ["Jenkinsfile", "pom.xml"],
    "ttl_days": null,
    "expires_at": null,
    "decay_score": 0.85,
    "status": "active",
    "embedding": null,
    "embedding_model": null
  },
  {
    "id": "mem_20260805_080000_mno345",
    "schema_version": 2,
    "scope": "global",
    "visibility": "global",
    "owner_agent": "agent-lead",
    "created_at": "2026-08-05T08:00:00+08:00",
    "updated_at": "2026-08-05T08:00:00+08:00",
    "source_conversation_id": "example-conv-004",
    "type": "fact",
    "title": "ai4s-backend tech stack",
    "summary": "Backend uses Java 17, Spring Boot 3.x, Maven for build. Frontend uses Next.js + TypeScript. Admin panel is a separate Next.js app. All deployed on internal Kubernetes cluster.",
    "details": null,
    "tags": ["tech-stack", "java", "spring-boot", "nextjs", "kubernetes"],
    "importance": 0.6,
    "priority": "P2",
    "access_count": 0,
    "last_accessed": null,
    "related_files": ["pom.xml", "package.json"],
    "ttl_days": null,
    "expires_at": null,
    "decay_score": 0.6,
    "status": "active",
    "embedding": null,
    "embedding_model": null
  },
  {
    "id": "mem_20260805_090000_shared01",
    "schema_version": 2,
    "scope": "workspace",
    "visibility": "shared",
    "owner_agent": "agent-be",
    "created_at": "2026-08-05T09:00:00+08:00",
    "updated_at": "2026-08-05T09:00:00+08:00",
    "source_conversation_id": "example-conv-005",
    "type": "state",
    "title": "重构进度：第3步完成待review",
    "summary": "用户中心重构进行到第 3 步（服务层拆分），已完成并自测通过，待 agent-lead review。第 4 步计划：控制器层接入。遗留问题：旧 Session 兼容层暂未迁移。",
    "details": "涉及文件：src/user/service.py, src/user/controller.py。分支：refactor/user-center-v2。",
    "tags": ["refactor", "user-center", "progress", "handoff"],
    "importance": 0.65,
    "priority": "P2",
    "access_count": 0,
    "last_accessed": null,
    "related_files": ["src/user/service.py", "src/user/controller.py"],
    "ttl_days": null,
    "expires_at": null,
    "decay_score": 0.65,
    "status": "active",
    "embedding": null,
    "embedding_model": null
  },
  {
    "id": "mem_20260805_093000_private01",
    "schema_version": 2,
    "scope": "workspace",
    "visibility": "private",
    "owner_agent": "agent-be",
    "created_at": "2026-08-05T09:30:00+08:00",
    "updated_at": "2026-08-05T09:30:00+08:00",
    "source_conversation_id": "example-conv-005",
    "type": "preference",
    "title": "agent-be 临时工作偏好",
    "summary": "本次重构期间，agent-be 倾向先写测试再实现（TDD），仅本次任务适用，不入全局偏好库。",
    "details": null,
    "tags": ["internal", "tdd", "temporary"],
    "importance": 0.4,
    "priority": "P3",
    "access_count": 0,
    "last_accessed": null,
    "related_files": [],
    "ttl_days": 7,
    "expires_at": "2026-08-12T09:30:00+08:00",
    "decay_score": 0.4,
    "status": "active",
    "embedding": null,
    "embedding_model": null
  }
]
